[
  {
    "activity_quality": 0.7,
    "body_composition_quality": 0.8,
    "cpet_quality": 0.85,
    "diet_quality": 0.75,
    "genetics_quality": 0.8,
    "harmonization_feasibility": 0.85,
    "metabolomics_quality": 1.0,
    "metadata_completeness": 1.0,
    "overall_score": 0.885,
    "rationale": [
      "Metabolomics assay platform is reported.",
      "CPET phenotype is documented for comparison planning."
    ],
    "scope_status": "in_scope_human",
    "study_design_rigor": 1.0,
    "study_id": "SYN-METEX-GEN",
    "temporal_alignment": 0.8,
    "weights": {
      "activity_quality": 0.1,
      "body_composition_quality": 0.05,
      "cpet_quality": 0.1,
      "diet_quality": 0.05,
      "genetics_quality": 0.1,
      "harmonization_feasibility": 0.05,
      "metabolomics_quality": 0.15,
      "metadata_completeness": 0.15,
      "study_design_rigor": 0.15,
      "temporal_alignment": 0.1
    }
  },
  {
    "activity_quality": 0.85,
    "body_composition_quality": 0.8,
    "cpet_quality": 0.25,
    "diet_quality": 0.3,
    "genetics_quality": 0.35,
    "harmonization_feasibility": 0.85,
    "metabolomics_quality": 1.0,
    "metadata_completeness": 1.0,
    "overall_score": 0.772,
    "rationale": [
      "Metabolomics assay platform is reported."
    ],
    "scope_status": "in_scope_human",
    "study_design_rigor": 1.0,
    "study_id": "SYN-ACTI-MET",
    "temporal_alignment": 0.8,
    "weights": {
      "activity_quality": 0.1,
      "body_composition_quality": 0.05,
      "cpet_quality": 0.1,
      "diet_quality": 0.05,
      "genetics_quality": 0.1,
      "harmonization_feasibility": 0.05,
      "metabolomics_quality": 0.15,
      "metadata_completeness": 0.15,
      "study_design_rigor": 0.15,
      "temporal_alignment": 0.1
    }
  },
  {
    "activity_quality": 0.25,
    "body_composition_quality": 0.3,
    "cpet_quality": 0.25,
    "diet_quality": 0.75,
    "genetics_quality": 0.8,
    "harmonization_feasibility": 0.85,
    "metabolomics_quality": 0.8,
    "metadata_completeness": 0.857,
    "overall_score": 0.629,
    "rationale": [
      "Metabolomics assay platform is reported."
    ],
    "scope_status": "in_scope_human",
    "study_design_rigor": 0.8,
    "study_id": "SYN-OMICS-GEN",
    "temporal_alignment": 0.35,
    "weights": {
      "activity_quality": 0.1,
      "body_composition_quality": 0.05,
      "cpet_quality": 0.1,
      "diet_quality": 0.05,
      "genetics_quality": 0.1,
      "harmonization_feasibility": 0.05,
      "metabolomics_quality": 0.15,
      "metadata_completeness": 0.15,
      "study_design_rigor": 0.15,
      "temporal_alignment": 0.1
    }
  },
  {
    "activity_quality": 0.7,
    "body_composition_quality": 0.3,
    "cpet_quality": 0.85,
    "diet_quality": 0.3,
    "genetics_quality": 0.35,
    "harmonization_feasibility": 0.25,
    "metabolomics_quality": 0.4,
    "metadata_completeness": 0.143,
    "overall_score": 0.484,
    "rationale": [
      "Variable dictionary/codebook missing or incomplete.",
      "Biospecimen timing is not sufficiently documented.",
      "CPET phenotype is documented for comparison planning."
    ],
    "scope_status": "in_scope_human",
    "study_design_rigor": 0.9,
    "study_id": "SYN-EXER-NODATA",
    "temporal_alignment": 0.35,
    "weights": {
      "activity_quality": 0.1,
      "body_composition_quality": 0.05,
      "cpet_quality": 0.1,
      "diet_quality": 0.05,
      "genetics_quality": 0.1,
      "harmonization_feasibility": 0.05,
      "metabolomics_quality": 0.15,
      "metadata_completeness": 0.15,
      "study_design_rigor": 0.15,
      "temporal_alignment": 0.1
    }
  },
  {
    "activity_quality": 0.7,
    "body_composition_quality": 0.3,
    "cpet_quality": 0.25,
    "diet_quality": 0.3,
    "genetics_quality": 0.35,
    "harmonization_feasibility": 0.85,
    "metabolomics_quality": 1.0,
    "metadata_completeness": 1.0,
    "overall_score": null,
    "rationale": [
      "Study participants are documented as non-human; the readiness scale is defined for human MoTrPAC-style comparison planning, so no overall score is reported. Subscores are retained for transparency.",
      "Metabolomics assay platform is reported."
    ],
    "scope_status": "out_of_scope_non_human",
    "study_design_rigor": 0.7,
    "study_id": "SYN-ANIMAL-MET",
    "temporal_alignment": 0.8,
    "weights": {
      "activity_quality": 0.1,
      "body_composition_quality": 0.05,
      "cpet_quality": 0.1,
      "diet_quality": 0.05,
      "genetics_quality": 0.1,
      "harmonization_feasibility": 0.05,
      "metabolomics_quality": 0.15,
      "metadata_completeness": 0.15,
      "study_design_rigor": 0.15,
      "temporal_alignment": 0.1
    }
  },
  {
    "activity_quality": 0.25,
    "body_composition_quality": 0.3,
    "cpet_quality": 0.25,
    "diet_quality": 0.3,
    "genetics_quality": 0.35,
    "harmonization_feasibility": 0.25,
    "metabolomics_quality": 1.0,
    "metadata_completeness": 0.857,
    "overall_score": 0.546,
    "rationale": [
      "Variable dictionary/codebook missing or incomplete.",
      "Metabolomics assay platform is reported."
    ],
    "scope_status": "in_scope_human",
    "study_design_rigor": 0.7,
    "study_id": "SYN-MET-NOCODEBOOK",
    "temporal_alignment": 0.35,
    "weights": {
      "activity_quality": 0.1,
      "body_composition_quality": 0.05,
      "cpet_quality": 0.1,
      "diet_quality": 0.05,
      "genetics_quality": 0.1,
      "harmonization_feasibility": 0.05,
      "metabolomics_quality": 0.15,
      "metadata_completeness": 0.15,
      "study_design_rigor": 0.15,
      "temporal_alignment": 0.1
    }
  },
  {
    "activity_quality": 0.7,
    "body_composition_quality": 0.8,
    "cpet_quality": 0.85,
    "diet_quality": 0.3,
    "genetics_quality": 0.35,
    "harmonization_feasibility": 0.85,
    "metabolomics_quality": 1.0,
    "metadata_completeness": 1.0,
    "overall_score": 0.818,
    "rationale": [
      "Metabolomics assay platform is reported.",
      "CPET phenotype is documented for comparison planning."
    ],
    "scope_status": "in_scope_human",
    "study_design_rigor": 1.0,
    "study_id": "SYN-CPET-RICH",
    "temporal_alignment": 0.8,
    "weights": {
      "activity_quality": 0.1,
      "body_composition_quality": 0.05,
      "cpet_quality": 0.1,
      "diet_quality": 0.05,
      "genetics_quality": 0.1,
      "harmonization_feasibility": 0.05,
      "metabolomics_quality": 0.15,
      "metadata_completeness": 0.15,
      "study_design_rigor": 0.15,
      "temporal_alignment": 0.1
    }
  },
  {
    "activity_quality": 0.85,
    "body_composition_quality": 0.8,
    "cpet_quality": 0.85,
    "diet_quality": 0.75,
    "genetics_quality": 0.8,
    "harmonization_feasibility": 0.85,
    "metabolomics_quality": 1.0,
    "metadata_completeness": 1.0,
    "overall_score": 0.9,
    "rationale": [
      "Metabolomics assay platform is reported.",
      "CPET phenotype is documented for comparison planning."
    ],
    "scope_status": "in_scope_human",
    "study_design_rigor": 1.0,
    "study_id": "SYN-MOTRPAC-LIKE",
    "temporal_alignment": 0.8,
    "weights": {
      "activity_quality": 0.1,
      "body_composition_quality": 0.05,
      "cpet_quality": 0.1,
      "diet_quality": 0.05,
      "genetics_quality": 0.1,
      "harmonization_feasibility": 0.05,
      "metabolomics_quality": 0.15,
      "metadata_completeness": 0.15,
      "study_design_rigor": 0.15,
      "temporal_alignment": 0.1
    }
  },
  {
    "activity_quality": 0.25,
    "body_composition_quality": 0.8,
    "cpet_quality": 0.25,
    "diet_quality": 0.75,
    "genetics_quality": 0.35,
    "harmonization_feasibility": 0.85,
    "metabolomics_quality": 1.0,
    "metadata_completeness": 1.0,
    "overall_score": 0.66,
    "rationale": [
      "Metabolomics assay platform is reported."
    ],
    "scope_status": "in_scope_human",
    "study_design_rigor": 0.8,
    "study_id": "SYN-DIET-BODY",
    "temporal_alignment": 0.35,
    "weights": {
      "activity_quality": 0.1,
      "body_composition_quality": 0.05,
      "cpet_quality": 0.1,
      "diet_quality": 0.05,
      "genetics_quality": 0.1,
      "harmonization_feasibility": 0.05,
      "metabolomics_quality": 0.15,
      "metadata_completeness": 0.15,
      "study_design_rigor": 0.15,
      "temporal_alignment": 0.1
    }
  },
  {
    "activity_quality": 0.25,
    "body_composition_quality": 0.3,
    "cpet_quality": 0.25,
    "diet_quality": 0.3,
    "genetics_quality": 0.8,
    "harmonization_feasibility": 0.85,
    "metabolomics_quality": 0.8,
    "metadata_completeness": 0.857,
    "overall_score": 0.606,
    "rationale": [
      "Metabolomics assay platform is reported."
    ],
    "scope_status": "in_scope_human",
    "study_design_rigor": 0.8,
    "study_id": "SYN-RESTRICTED-META",
    "temporal_alignment": 0.35,
    "weights": {
      "activity_quality": 0.1,
      "body_composition_quality": 0.05,
      "cpet_quality": 0.1,
      "diet_quality": 0.05,
      "genetics_quality": 0.1,
      "harmonization_feasibility": 0.05,
      "metabolomics_quality": 0.15,
      "metadata_completeness": 0.15,
      "study_design_rigor": 0.15,
      "temporal_alignment": 0.1
    }
  }
]
